{
  "$schema": "https://json-schema.org/draft/2020-12/schema",
  "$id": "https://github.com/KlaraGraff/XL_Translator-extensions/blob/main/schema/entry.schema.json",
  "title": "Translator extension list entry",
  "description": "One file per extension: extensions/<id>.json. Translator reads index.json, which is built from these files.",
  "type": "object",
  "additionalProperties": false,
  "required": [
    "id", "name", "summary", "extensions", "author", "repo", "license", "version",
    "adapter_api_version", "download", "sha256", "size", "status"
  ],
  "properties": {
    "id": {
      "description": "The id in the extension's adapter.json; the file name is <id>.json.",
      "type": "string",
      "pattern": "^[a-z0-9][a-z0-9_-]{0,39}$"
    },
    "name": {"description": "The type's name (adapter.json label).", "$ref": "#/$defs/texts"},
    "summary": {"description": "One or two sentences: which files it translates and what it leaves alone.", "$ref": "#/$defs/texts"},
    "extensions": {
      "description": "File extensions without the dot, as in adapter.json.",
      "type": "array",
      "minItems": 1,
      "items": {"type": "string", "pattern": "^\\.?[A-Za-z0-9]{1,16}$"}
    },
    "author": {"type": "string", "minLength": 1},
    "repo": {"description": "The project's home page.", "type": "string", "pattern": "^https://"},
    "license": {"type": "string", "minLength": 1},
    "version": {"description": "The version in adapter.json.", "type": "string", "minLength": 1, "maxLength": 40},
    "adapter_api_version": {"type": "integer", "minimum": 1},
    "min_app_version": {"description": "Lowest Translator version it needs; empty for any.", "type": "string"},
    "download": {
      "description": "Where the zip can be downloaded, tried in order; every address must serve the same file.",
      "type": "array",
      "minItems": 1,
      "maxItems": 5,
      "items": {"type": "string", "pattern": "^https://"}
    },
    "sha256": {"type": "string", "pattern": "^[0-9a-f]{64}$"},
    "size": {"description": "Size of the zip in bytes.", "type": "integer", "minimum": 1, "maximum": 2097152},
    "tags": {"type": "array", "items": {"type": "string"}},
    "status": {
      "description": "official: maintained by the Translator project. reviewed: reviewed and accepted.",
      "enum": ["official", "reviewed"]
    },
    "reviewed_at": {"description": "Date of the review (YYYY-MM-DD), filled in on merge.", "type": "string"},
    "reviewed_by": {"description": "Who reviewed it, filled in on merge.", "type": "string"}
  },
  "$defs": {
    "texts": {
      "type": "object",
      "additionalProperties": false,
      "required": ["zh", "en", "fr"],
      "properties": {
        "zh": {"type": "string", "minLength": 1},
        "en": {"type": "string", "minLength": 1},
        "fr": {"type": "string", "minLength": 1}
      }
    }
  }
}
